Brand,Make_Model,Date of Sale,Sale Price,Year,Mileage,Classification,Transmission,Fuel Type,Description,Sale Location
Audi,Audi A1 (TFSI),06/01/2024,"€4,800.00",2012,"130,377",Hatchback,Manual,Petrol,Grey Audi A11.4 TFSI Sport Euro 5 (s/s) 3dr2 previous owners,Waterford
Audi,Audi Q7 (S line Plus),07/01/2024,"€14,450.00",2012,"91,483",SUV,Automatic,Diesel,Blue Audi Q73.0 TDI S line Plus Tiptronic quattro 5dr1 previous owner,Clare
Audi,Audi RS3 (TFSI),09/01/2024,"€70,256.00",2022,"3,869",Saloon,Automatic,Petrol,Black Audi RS3 SALOON2.5 RS 3 TFSI QUATTRO VORSPRUNG 4d 395 BHP TOP SPEC+S/S SEATS+MATRIX LED2 previous owners,Mayo
Audi,Audi A3 (S line),09/01/2024,"€10,308.00",2013,"83,389",Hatchback,Manual,Diesel,Black Audi A32.0 TDI S line Hatchback 3dr Diesel Manual Euro 5 (s/s) (150 ps)4 previous owners,Limerick
Audi,Audi A6 Saloon (ultra),2024-01-09,"€21,833.00",2018,"42,918",Saloon,Automatic,Diesel,Red Audi A6 Saloon2.0 TDI Ultra Black Edition 4dr S Tronic Leather Seats,Dublin
Audi,Audi S3 (TFSI),2024-01-09,"€20,345.00",2016,73451,Hatchback,Automatic,Petrol,Blue Audi S32.0 TFSI Sportback 5dr Petrol S Tronic quattro Euro 6 (s/s) (310 ps)4 previous owners,Laois
Audi,Audi Q2 (TFSI),10/01/2024,"€27,307.00",2020,"17,520",SUV,Automatic,Petrol,Audi Q2S line 35 TFSI 150 PS S tronic 1.5 5dr,Dublin
Audi,Audi Q2 (CoD),10/01/2024,"€19,056.00",2018,"60,224",SUV,Automatic,Petrol,Blue Audi Q21.4 TFSI CoD S line S Tronic Euro 6 (s/s) 5dr1 previous owner,Donegal
Audi,Audi TT (TFSI),10/01/2024,"€ 7,166",2009,"55,056",Convertible,Manual,Petrol,Red Audi TT2.0 TFSI Roadster 2dr Petrol Manual Euro 4 (200 ps)3 previous owners,Dublin
Audi,Audi Q2 (TFSI),10/01/2024,"€21,153.00",2018,"32,692",SUV,Manual,Petrol,Navy Audi Q2S line 1.4 TFSI cylinder on demand 150 PS 6-speed 5dr2 previous owners,Cork
Audi,Audi Q2 (CoD),14/01/2024,"€29,341.00",2021,"10,255",SUV,Automatic,Petrol,Grey Audi Q2S line 35 TFSI 150 PS S tronic 1.5 5dr1 previous owner,Dublin
Audi,Audi A1 (Black Edition),2024-01-15,"€14,933.00",2016,"31,341",Hatchback,Automatic,Diesel,Navy Audi A11.6 TDI Black Edition S Tronic Euro 6 (s/s) 3dr2 previous owners,Meath
Audi,Audi Q2 (TFSI),16/01/2024,"€20,366.00",2017,36368,SUV,Automatic,Petrol,Black Audi Q21.4 TFSI (150ps) S-Line (CoD) S Tronic SUV 5dr1 previous owner,Kerry
Audi,Audi S4 (TFSI V6),2024-01-17,"€ 12,346",2009,"89,140",Saloon,Automatic,Petrol,Grey Audi S43.0 TFSI V6 Saloon 4dr Petrol S Tronic quattro Euro 5 (333 ps)5 previous owners,Cork
Audi,Audi A4 (Black Edition),17/01/2024,"€20,586.00",2019,"57,654",Saloon,Automatic,Petrol,Red Audi A42.0 TFSI 35 Black Edition Saloon 4dr Petrol S Tronic Euro 6 (s/s) (150 ps)1 previous owner,Limerick
Audi,Audi A3 (TDI),18/01/2024,"€9,535.00",2015,75898,Hatchback,Manual,Diesel,Grey Audi A3TDI SE TECHNIK 1.6 5dr,Dublin
Audi,Audi A4 (TDI),18/01/2024,"€17,864.00",2016,"41,328",Saloon,Automatic,Diesel,Black Audi A42.0 TDI 190 Quattro Sport 4dr S Tronic,Dublin
Audi,Audi Q3 (TDI),19/01/2024,"€17,799.00",2018,"65,776",SUV,Manual,Diesel,Blue Audi Q32L S line Edition TDI 5dr,Donegal
Audi,Audi A4 Avant (TDI),19/01/2024,"€8,848.00",2011,"72,177",Estate,Automatic,Diesel,Blue Audi A4 Avant2.0 TDI Executive S line Multitronic Euro 4 5dr,Cork
Audi,Audi A3 (S line),2024-01-20,"€3,480.00",2010,"118,338",Hatchback,Manual,Diesel,Blue Audi A32.0 TDI S line Sportback 5dr Diesel Manual Euro 5 (s/s) (140 ps)4 previous owners,Cork
Audi,Audi Q3 (TDI),2024-01-20,"€13,423.00",2018,"105,879",SUV,Manual,Diesel,Blue Audi Q32.0 TDI Sport Euro 6 (s/s) 5dr,Laois
Audi,Audi Q2 (TFSI),20/01/2024,"€22,142.00",2019,"28,311",SUV,Automatic,Petrol,Red Audi Q21.5 TFSI CoD 35 S line SUV 5dr Petrol S Tronic (s/s) (150 ps)2 previous owners,Dublin
Audi,Audi A4 (TFSI),21/01/2024,"€20,739.00",2017,"22,171",Saloon,Automatic,Petrol,"Black Audi A42.0 TFSI S LINE 4d 188 BHP Euro 6, Heated Seats, 1 Prev Owner",Dublin
Audi,Audi A4 (TDI),22/01/2024,"€14,793.00",2016,"40,041",Saloon,Manual,Diesel,Black Audi A42.0 TDI ultra SE Euro 6 (s/s) 4dr3 previous owners,Longford
Audi,Audi Q3 (S line),2024-01-22,"€36,111.00",2021,"20,457 miles",SUV,Automatic,Petrol,Audi Q3 AVANT35 TFSI S Line 5dr S Tronic 1.5,Dublin
Audi,Audi A4 (Black Edition),2024-01-23,"€18,363.00",2018,"48,786",Saloon,Automatic,Petrol,Red Audi A41.4T FSI Black Edition 4dr S Tronic Saloon,Limerick
Audi,Audi A5 (S line),24/01/2024,"€34,128.00",2021,"5,224",Hatchback,Automatic,Diesel,Red Audi A5Sportback S line 35 TDI 163 PS S tronic 2.0 5dr,Kerry
Audi,Audi A5 (S line),2024-01-24,"€12,812.00",2015,"102,434",Hatchback,Automatic,Diesel,Blue Audi A53.0 TDI V6 S line Sportback S Tronic quattro Euro 6 (s/s) 5dr2 previous owners,Carlow
Audi,Audi Q7 (TDI V6),25/01/2024,"€56,245.00",2019,"22,223",SUV,Automatic,Diesel,Blue Audi Q750 TDI Quattro Vorsprung 5dr 3.0,Cork
Audi,Audi A1 (S line),2024-01-25,"€7,881.00",2013,"78,971",Hatchback,Manual,Diesel,Silver Audi A11.6 TDI S line Sportback Euro 5 (s/s) 5dr4 previous owners,Meath
Audi,Audi A3 Cabriolet (TDI),2024-01-25,"€11,804.00",2012,"22,805",Convertible,Automatic,Diesel,Audi A3 Cabriolet2.0 TDI Sport S Tronic 2dr2 previous owners,Dublin
Audi,Audi A1 (TDI),2024-01-26,"€9,880.00",2013,"77,316",Hatchback,Manual,Diesel,Red Audi A1SPORTBACK TDI S LINE BLACK EDITION 2.0 5dr,Tipperary
Audi,Audi Q2 (S line),26/01/2024,"€23,040.00",2018,"15,373",SUV,Automatic,Petrol,Blue Audi Q21.4 Tfsi S Line 5Dr S Tronic1 previous owner,Dublin
Audi,Audi TT (S line),26/01/2024,"€ 15,865",2016,"94,779",Convertible,Automatic,Petrol,Navy Audi TT2.0 TFSI S line+HUGE SPEC+ Roadster 2dr Petrol S Tronic quattro Euro 6 (s/s) (230 ps),Wicklow
Audi,Audi A6 Avant (Black Edition),27/01/2024,"€12,946.00",2014,"120,051",Estate,Automatic,Diesel,Black Audi A6 Avant2.0 TDI ultra Black Edition S Tronic Euro 6 (s/s) 5dr2 previous owners,Dublin
Audi,Audi Q2 (CoD),28/01/2024,"€15,262.00",2020,11229,S.U.V.,Manual,Petrol,Red Audi Q21.5 TFSI CoD 35 S line Euro 6 (s/s) 5dr1 previous owner,Dublin
Audi,Audi A7 (TDI V6),2024-01-30,"€19,416.00",2016,"64,275",Hatchback,Automatic,Diesel,Audi A73.0 TDI V6 ultra S line Sportback S Tronic Euro 6 (s/s) 5dr3 previous owners,Mayo
Audi,Audi A5 (Black Edition Plus),30/01/2024,"€ 16,815",2016,"59,380",Coupe,Manual,Diesel,Blue Audi A52.0 TDI 190 Quattro Black Edition Plus 2dr,Waterford
Audi,Audi A3 (Edition 1),30/01/2024,"€36,253.00",2021,"7,603",Hatchback,Manual,Diesel,Silver Audi A3Sportback Edition 1 35 TDI 150 PS 6-speed 2.0 5dr,Dublin
Audi,Audi Q2 (TDI),03/02/2024,"€20,893.00",2019,"11,446",SUV,Manual,Diesel,Grey Audi Q230 TDI Sport 5dr 1.6,Wicklow
BMW,BMW 4 Series (M Sport),2024-01-02,"€15,899.00",2016,"75,663",Convertible,Automatic,Diesel,Blue BMW 4 SERIES420d 2.0 190 Bhp M SPORT NAV 2dr,Galway
BMW,BMW 4 Series Gran Coupe (428i),04/01/2024,"€20,641.00",2015,"37,197",Hatchback,Automatic,Petrol,Red BMW 4 Series Gran Coupe2.0 428i M Sport Auto Euro 6 (s/s) 5dr2 previous owners,Cork
BMW,BMW 1 Series (116i),04/01/2024,"€9,453.00",2012,"43,305",Hatchback,Manual,Petrol,Red BMW 1 SERIES1.6 116I SE 5d 135 BHP BLUETOOTH TELEPHONE CONNECTION2 previous owners,Dublin
BMW,BMW 4 Series Gran Coupe (M Sport),05/01/2024,"€18,819.00",2016,"83,413",Hatchback,Automatic,Diesel,Grey BMW 4 Series Gran Coupe3.0 435d M Sport Auto xDrive Euro 6 (s/s) 5dr3 previous owners,Cork
BMW,BMW X2 (18d),07/01/2024,"€19,818.00",2019,"28,819",SUV,Manual,Diesel,Red BMW X2xDrive 18d SE 5dr 2.01 previous owner,Laois
BMW,BMW 3 Series (SE),08/01/2024,"€14,244.00",2017,"35,373 miles",Saloon,Manual,Diesel,Blue BMW 3 SeriesBMW 3 316d 2.0 SE 4dr1 previous owner,Sligo
BMW,BMW 1 Series (M Sport Shadow Edition),2024-01-08,"€16,561.00",2018,38738,Hatchback,Manual,Petrol,Black BMW 1 SERIES1.5 118I M SPORT SHADOW EDITION 5d 134 BHP1 previous owner,Dublin
BMW,BMW X2 (Sport),08/01/2024,"€30,481.00",2021,"6,740",SUV,Automatic,Petrol,Silver BMW X2 SeriesX2 sDrive20i Sport 2.0 5dr2 previous owners,Cavan
BMW,BMW 4 Series Gran Coupe (Sport),2024-01-10,"€12,713.00",2015,"101,242",Hatchback,Automatic,Diesel,Black BMW 4 Series Gran Coupe2.0 420d Sport Auto Euro 6 (s/s) 5dr2 previous owners,Dublin
BMW,BMW 1 Series (118i),10/01/2024,"€8,217.00",2015,"131,119",Hatchback,Manual,Petrol,Silver BMW 1 Series1.5 118i SE Euro 6 (s/s) 5dr2 previous owners,Galway
BMW,BMW 5 Series (540i),10/01/2024,"€23,374.00",2018,"77,418",Saloon,Automatic,Petrol,BMW 5 Series3.0 540i SE Auto xDrive Euro 6 (s/s) 4dr1 previous owner,Laois
BMW,BMW 1 Series (Sport),12/01/2024,"€2,758.00",2010,144154,Hatchback,Manual,Diesel,Black BMW 1 Series2.0 116d Sport Euro 5 (s/s) 5dr4 previous owners,Cork
BMW,BMW 1 Series (M Sport),12/01/2024,"€6,956.00",2011,"94,996",Convertible,Manual,Diesel,Grey BMW 1 SERIES2.0 120D M SPORT 2d 175 BHP 3 MONTH WARRANTY LOW MILES M SPORT,Dublin
BMW,BMW 1 Series (M Sport),12/01/2024,"€9,012.00",2013,"80,008",Hatchback,Manual,Diesel,Red BMW 1 Series2.0 118d M Sport Euro 5 (s/s) 5dr3 previous owners,Cavan
BMW,BMW 1 Series (M Sport),2024-01-12,"€10,627.00",2015,"57,315",Hatchback,Manual,Diesel,Red BMW 1 Series2.0 118d M Sport Hatchback 3dr Diesel Manual Euro 6 (s/s) (150 ps)2 previous owners,Donegal
BMW,BMW X3 (SE),14/01/2024,"€5,377.00",2012,"155,724",SUV,Automatic,Diesel,Red BMW X32.0 20d SE SUV 5dr Diesel Steptronic xDrive Euro 5 (s/s) (184 ps)6 previous owners,Tipperary
BMW,BMW 1 Series (120d),14/01/2024,"€16,350.00",2017,"50,017",Hatchback,Manual,Diesel,Silver BMW 1 SERIES2.0 120D M SPORT 5d 188 BHP,Kerry
BMW,BMW X5 (SE),14/01/2024,"€22,646.00",2017,"90,117 miles",SUV,Automatic,Diesel,Navy BMW X53.0 XDRIVE30D SE 5d 255 BHP2 previous owners,Kerry
BMW,BMW 1 Series (M135i),15/01/2024,"€14,400.00",2013,"80,237",Hatchback,Automatic,Petrol,Blue BMW 1 Series3.0 M135i Auto Euro 5 (s/s) 5dr5 previous owners,Waterford
BMW,BMW 3 Series (320d ED),16/01/2024,"€9,745.00",2013,"80,691",Saloon,Automatic,Diesel,BMW 3 Series2.0 320d ED EfficientDynamics Business Auto Euro 5 (s/s) 4dr3 previous owners,Westmeath
BMW,BMW 7 Series (M Sport),17/01/2024,"€60,176.00",2021,"2,982",Saloon,Automatic,Diesel,BMW 7 Series730d M Sport Saloon 3.0 4dr1 previous owner,Meath
BMW,BMW 1 Series (118i),17/01/2024,"€17,742.00",2018,"8,446",Hatchback,Auto,Petrol,Navy BMW 1 Series1.5 118i GPF Sport Auto Euro 6 (s/s) 5dr2 previous owners,Tipperary
BMW,BMW 1 Series (116i),2024-01-18,"€9,023.00",2013,"70,718",Hatchback,Manual,Petrol,Navy BMW 1 Series1.6 116i Sport Euro 6 (s/s) 5dr3 previous owners,Dublin
BMW,BMW 4 Series Gran Coupe (M Sport),18/01/2024,"€24,152.00",2019,"16,114",Hatchback,Auto,Petrol,Red BMW 4 SERIES GRAN COUPE2.0 420I M SPORT GRAN COUPE 4d AUTO 181 BHP1 previous owner,Limerick
BMW,BMW M4 (Competition M),19/01/2024,"€73,904.00",2022,"3,891",Convertible,Automatic,Petrol,Red BMW 4 SERIES3.0 M4 Competition Edition M xDrive Auto 4WD 2dr,Galway
BMW,BMW 4 Series (420i),19/01/2024,"€38,468.00",2021,"12,206",Convertible,Automatic,Petrol,BMW 4 Series420i M Sport Convertible 2.0 2dr1 previous owner,Cork
BMW,BMW 4 Series Gran Coupe (M Sport),20/01/2024,"€24,383.00",2018,"29,881",Hatchback,Automatic,Diesel,Navy BMW 4 Series Gran Coupe3.0 430d M Sport Auto Euro 6 (s/s) 5dr2 previous owners,Limerick
BMW,BMW 1 Series (116d),21/01/2024,"€16,577.00",2019,"47,423 miles",Hatchback,Manual,Diesel,Grey BMW 1 Series1.5TD 116d M Sport Shadow Edition 5 Door1 previous owner,Waterford
BMW,BMW 2 Series (220d),22/01/2024,"€21,709.00",2019,"27,162",Coupe,Automatic,Diesel,Silver BMW 2 Series220d M Sport Coupe 2.0 2dr2 previous owners,Dublin
BMW,BMW 5 Series (520d),23/01/2024,"€11,291.00",2015,"116,594",Saloon,Automatic,Diesel,Blue BMW 5 Series2.0 520d Luxury Auto Euro 6 (s/s) 4dr3 previous owners,Kildare
BMW,BMW 1 Series (116i),24/01/2024,"€5,238.00",2011,"70,936",Hatchback,Manual,Petrol,Silver BMW 1 Series2.0 116i Sport Hatchback 5dr Petrol Manual Euro 5 (s/s) (122 ps)4 previous owners,Dublin
BMW,BMW M2 (Competition),25/01/2024,"€ 47,462",2020,6841,Coupe,Automatic,Petrol,Navy BMW M23.0 BiTurbo Competition Coupe 2dr Petrol DCT Euro 6 (s/s) (410 ps)1 previous owner,Dublin
BMW,BMW M4 (BiTurbo),25/01/2024,"€37,243.00",2017,"36,161 miles",Coupe,Automatic,Petrol,Blue BMW M43.0 BiTurbo DCT (s/s) 2dr4 previous owners,Mayo
BMW,BMW X5 (25d),26/01/2024,"€22,924.00",2015,"47,481 miles",SUV,Automatic,Diesel,Red BMW X52.0 XDRIVE25D M SPORT 5d 231 BHP ULEZ+LOW MILEAGE+AMBIENT LIGHTING,Dublin
BMW,BMW 4 Series (420i),26/01/2024,"€19,354.00",2018,"53,500",Coupe,Automatic,Petrol,Red BMW 4 Series2.0 420i GPF M Sport Auto Euro 6 (s/s) 2dr1 previous owner,Kildare
BMW,BMW M5 (i V8),27/01/2024,"€67,247.00",2020,"11,535",Saloon,Automatic,Petrol,BMW M5 SeriesM5 Competition Saloon 4.4 4dr1 previous owner,Dublin
BMW,BMW 5 Series (M Sport),29/01/2024,"€12,489.00",2008,"76,270",Saloon,Automatic,Diesel,Blue BMW 5 Series3.0 535d M Sport Steptronic Euro 4 4dr3 previous owners,Westmeath
BMW,BMW 1 Series (116d),29/01/2024,"€13,643.00",2018,"31,200",Hatchback,Manual,Diesel,Blue BMW 1 SERIES1.5 116D SE BUSINESS 5d 114 BHP PARK SENSORS~D.A.B.~BLUE TOOTH,Louth
BMW,BMW 5 Series (M Sport),2024-02-01,"€17,836.00",2017,92298,Saloon,Automatic,Diesel,Red BMW 5 Series2.0 520d M Sport Saloon 4dr Diesel Auto Euro 6 (s/s) (190 ps)2 previous owners,Louth
BMW,BMW 4 Series Gran Coupe (420d),01/02/2024,"€18,196.00",2017,"53,606",Hatchback,Automatic,Diesel,Grey BMW 4 Series Gran Coupe2.0 420d M Sport Auto Euro 6 (s/s) 5dr,Dublin
Mercedes-Benz,Mercedes-Benz GLA Class (GLA180),02/01/2024,"€28,158.00",2019,"10,107",SUV,Automatic,Petrol,Red Mercedes-Benz GLAGla 180 Amg Line Edition 5Dr Auto 1.61 previous owner,Mayo
Mercedes-Benz,Mercedes-Benz C Class (BlueEfficiency),02/01/2024,"€ 7,480",2011,"96,427",Saloon,Automatic,Diesel,Red Mercedes-Benz C Class2.1 C220 CDI BlueEfficiency Sport Edition 125 7G-Tronic 4dr,Wicklow
Mercedes-Benz,Mercedes-Benz C Class (C180),03/01/2024,"€7,787.00",2012,"97,058 miles",Saloon,Automatic,Petrol,Blue Mercedes-Benz C Class1.6 C180 BlueEfficiency Executive SE G-Tronic+ Euro 5 (s/s) 4dr,Dublin
Mercedes-Benz,Mercedes-Benz GLA Class (Urban Edition),2024-01-05,"€24,399.00",2019,"9,764 miles",SUV,Automatic,Petrol,Silver Mercedes-Benz Gla Class1.6 GLA180 Urban Edition 7G-DCT Euro 6 (s/s) 5dr2 previous owners,Cork
Mercedes-Benz,Mercedes-Benz C Class (Executive SE),05/01/2024,"€ 10,694",2012,"36,210",Saloon,Automatic,Petrol,Silver Mercedes-Benz C Class1.6 C180 BlueEfficiency Executive SE G-Tronic+ Euro 5 (s/s) 4dr2 previous owners,Dublin
Mercedes-Benz,Mercedes-Benz A Class (AMG Line),2024-01-06,"€17,579.00",2017,"36,092 miles",Hatchback,Automatic,Diesel,Mercedes-Benz A Class1.5 A180d AMG Line 7G-DCT Euro 6 (s/s) 5dr2 previous owners,Cork
Mercedes-Benz,Mercedes-Benz GLE Class (GLE300d),06/01/2024,"€59,205.00",2020,"9,394",SUV,Automatic,Diesel,Blue Mercedes-Benz Gle Diesel EstateGLE 300d 4Matic AMG Line Prem Plus 5dr 9G-Tronic 2.01 previous owner,Kilkenny
Mercedes-Benz,Mercedes-Benz E Class (SE),07/01/2024,"€14,372.00",2013,"36,156",Saloon,Automatic,Diesel,Mercedes-Benz E Class2.1 E220 CDI SE 4DR AUTOMATIC2 previous owners,Kerry
Mercedes-Benz,Mercedes-Benz E Class (AMG Line),07/01/2024,"€24,196.00",2017,35149,Saloon,Automatic,Diesel,Red Mercedes-Benz E Class Diesel SaloonE220d AMG Line 4dr 9G-Tronic 2.01 previous owner,Dublin
Mercedes-Benz,Mercedes-Benz E Class (MHEV),07/01/2024,"€65,120.00",2022,"5,291",Saloon,Automatic,Petrol Hybrid,Navy Mercedes-Benz E-ClassE53 4Matic+ Night Edition Prem+ 4dr TCT Petrol Saloon 3.0,Dublin
Mercedes-Benz,Mercedes-Benz E Class (SE),2024-01-09,"€8,645.00",2013,"105,776",Estate,Manual,Diesel,Black Mercedes-Benz E Class2.1 E220 CDI SE Euro 5 (s/s) 5dr,Meath
Mercedes-Benz,Mercedes-Benz C Class (C200),2024-01-10,"€26,363.00",2019,"11,356",Saloon,Automatic,Petrol,Navy Mercedes-Benz C ClassC200 AMG Line 4dr 9G-Tronic 1.51 previous owner,Offaly
Mercedes-Benz,Mercedes-Benz GLE Class (GLE300d),10/01/2024,"€50,430.00",2020,"23,590",SUV,Automatic,Diesel,Red Mercedes-Benz GLE300d 4Matic AMG Line Premium 5dr 9G-Tronic 2.0,Dublin
Mercedes-Benz,Mercedes-Benz E Class (E220),10/01/2024,"€15,096.00",2016,"84,627",Saloon,Automatic,Diesel,Black Mercedes-Benz E Class2.1 E220 BlueTEC AMG Night Edition (Premium) G-Tronic+ Euro 6 (s/s) 4dr2 previous owners,Westmeath
Mercedes-Benz,Mercedes-Benz A Class (A200),11/01/2024,"€25,056.00",2019,"16,650",Saloon,Manual,Petrol,Blue Mercedes-Benz A ClassA200 AMG Line Premium 4dr 1.32 previous owners,Clare
Mercedes-Benz,Mercedes-Benz E Class (BlueEfficiency),2024-01-13,"€5,592.00",2009,"101,463",Coupe,Automatic,Diesel,Blue Mercedes-Benz E Class3.0 E350 CDI V6 BlueEfficiency SE G-Tronic Euro 5 2dr3 previous owners,Roscommon
Mercedes-Benz,Mercedes-Benz CLA Class (AMG Line Night Edition),2024-01-13,"€23,756.00",2018,"60,195",Saloon,Automatic,Petrol,Black Mercedes-Benz Cla ClassCLA 200 AMG Line Night Edition Plus 4dr Tip Auto 1.6,Dublin
Mercedes-Benz,Mercedes-Benz E Class (SE),14/01/2024,"€21,245.00",2018,"87,299",Saloon,Automatic,Diesel,Red Mercedes-Benz E-Class2.0 E 220 D SE PREMIUM 4d 192 BHP,Galway
Mercedes-Benz,Mercedes-Benz CLA Class (CLA220d),2024-01-14,"€19,493.00",2017,"47,430",Saloon,Automatic,Diesel,Mercedes-Benz CLA2.1 CLA 220 D AMG LINE 4d 174 BHP HARMAN KARDON / DUAL AC / LED LIGHT2 previous owners,Dublin
Mercedes-Benz,Mercedes-Benz C Class (C250 CDI),2024-01-14,"€11,416.00",2013,"52,436",Coupe,Automatic,Diesel,Blue Mercedes-Benz C Class2.1 C250 CDI BlueEfficiency AMG Sport G-Tronic+ Euro 5 (s/s) 2dr3 previous owners,Donegal
Mercedes-Benz,Mercedes-Benz E Class (E400d),2024-01-16,"€ 41,748",2019,"20,844",Estate,Automatic,Diesel,Red Mercedes-Benz E ClassE400d 4Matic AMG Line Night Ed Prem+ 5dr 9G-Tronic 2.91 previous owner,Westmeath
Mercedes-Benz,Mercedes-Benz GLC Class (AMG Line),17/01/2024,"€37,384.00",2019,"20,194",SUV,Auto,Diesel,Silver Mercedes-Benz Glc Diesel EstateGLC 300d 4Matic AMG Line Premium 5dr 9G-Tronic 2.02 previous owners,Cork
Mercedes-Benz,Mercedes-Benz C Class (EQ Boost),2024-01-17,"€28,457.00",2019,"19,346 miles",Coupe,Automatic,Petrol,Blue Mercedes-Benz C ClassC200 AMG Line 2dr 9G-Tronic 1.5,Carlow
Mercedes-Benz,Mercedes-Benz CLC Class (CLC180K),18/01/2024,"€4,431.00",2009,"94,008 miles",Hatchback,Automatic,Petrol,Silver Mercedes-Benz Clc Class1.8 CLC180 Kompressor Sport 2dr3 previous owners,Mayo
Mercedes-Benz,Mercedes-Benz GLE Class (MHEV),19/01/2024,"€51,846.00",2019,"34,712",SUV,Automatic,Petrol,Black Mercedes-Benz Gle Class3.0 GLE450 EQ Boost AMG Line (Premium Plus) G-Tronic 4MATIC (s/s) 5dr (7 Seat)1 previous owner,Dublin
Mercedes-Benz,Mercedes-Benz CLA Class (AMG Sport),20/01/2024,"€14,266.00",2015,"92,439",Saloon,Automatic,Diesel,Blue Mercedes-Benz Cla Class2.1 CLA220 CDI AMG Sport Coupe 7G-DCT Euro 6 (s/s) 4dr,Cavan
Mercedes-Benz,Mercedes-Benz A Class (SE),20/01/2024,"€11,891.00",2014,"59,514",Hatchback,Manual,Diesel,Black Mercedes-Benz A-Class1.5 A180 CDI ECO SE 5d 109 BHP2 previous owners,Dublin
Mercedes-Benz,Mercedes-Benz E Class (E220d),20/01/2024,"€25,806.00",2018,"26,005",Estate,Automatic,Diesel,Navy Mercedes-Benz E-Class2.0 E 220 D AMG LINE 5d AUTO 192 BHP HEATED SEATS & CRUISE CONTROL2 previous owners,Dublin
Mercedes-Benz,Mercedes-Benz C Class (MHEV),2024-01-21,"€56,108.00",2022,5392,Saloon,Automatic,Petrol Hybrid,Grey Mercedes-Benz C ClassC 200 Sedan 1.5 4dr,Cork
Mercedes-Benz,Mercedes-Benz A Class (Sport),22/01/2024,"€13,603.00",2016,"40,677",Hatchback,Manual,Diesel,Blue Mercedes-Benz A-Class1.5 A 180 D SPORT 5d 107 BHP CRUISE CONTROL & HILL START1 previous owner,Dublin
Mercedes-Benz,Mercedes-Benz A Class (A200),23/01/2024,"€22,256.00",2019,"22,194",Hatchback,Manual,Petrol,Red Mercedes-Benz A ClassA200 AMG Line 5dr 1.3,Dublin
Mercedes-Benz,Mercedes-Benz E Class (AMG Line),23/01/2024,"€29,379.00",2018,"28,252",Coupe,Automatic,Diesel,Black Mercedes-Benz E ClassE220d 4Matic AMG Line Premium 2dr 9G-Tronic 2.0,Mayo
Mercedes-Benz,Mercedes-Benz CLS (Sport),23/01/2024,"€8,620.00",2011,136434,Saloon,Automatic,Diesel,Mercedes-Benz CLS3.0 CLS350 CDI V6 BlueEfficiency Sport Coupe G-Tronic+ Euro 5 4dr,Dublin
Mercedes-Benz,Mercedes-Benz GLE Class (GLE350d V6),24/01/2024,"€38,229.00",2018,"77,299",Coupe,Automatic,Diesel,Red Mercedes-Benz Gle Class3.0 GLE350d V6 AMG Night Edition (Premium Plus) G-Tronic 4MATIC Euro 6 (s/s) 5dr2 previous owners,Dublin
Mercedes-Benz,Mercedes-Benz E Class (E250 CDI),24/01/2024,"€16,968.00",2015,"49,728",Convertible,Automatic,Diesel,Red Mercedes-Benz E ClassE250 CDI AMG Line 2dr 7G-Tronic 2.13 previous owners,Kerry
Mercedes-Benz,Mercedes-Benz E Class (AMG Line),2024-01-26,"€20,478.00",2018,"90,257 miles",Saloon,Automatic,Diesel,Grey Mercedes-Benz E Class2.0 E220d AMG Line Saloon 4dr Diesel G-Tronic+ Euro 6 (s/s) (194 ps)3 previous owners,Tipperary
Mercedes-Benz,Mercedes-Benz E Class (MHEV),26/01/2024,"€58,481.00",2022,"4,828",Convertible,Automatic,Diesel Hybrid,Grey Mercedes-Benz E Class Diesel CabrioletE300d AMG Line Night Ed Premium+ 2dr 9G-Tronic 2.01 previous owner,Meath
Mercedes-Benz,Mercedes-Benz C Class (BlueTEC),26/01/2024,"€15,667.00",2014,"72,031",Saloon,Automatic,Diesel,Black Mercedes-Benz C ClassC250 BlueTEC AMG Line Premium Plus 4dr Auto 2.1,Donegal
Mercedes-Benz,Mercedes-Benz E Class (AMG Line),26/01/2024,"€26,276.00",2019,"58,491",Saloon,Automatic,Diesel,Blue Mercedes-Benz E-Class2.0 E 220 D AMG LINE 4d 192 BHP,Cork
Mercedes-Benz,Mercedes-Benz E Class (E220 CDI),27/01/2024,"€9,486.00",2014,"88,490",Saloon,Automatic,Diesel,Black Mercedes-Benz E Class2.1 E220 CDI SE Saloon 4dr Diesel G-Tronic+ Euro 5 (s/s) (170 ps)2 previous owners,Wexford
Volkswagen,Volkswagen Golf (GTI),2024-01-02,"€8,193.00",2010,"109,038",Hatchback,Automatic,Petrol,Navy Volkswagen Golf2.0 TSI GTI DSG Euro 5 5dr6 previous owners,Dublin
Volkswagen,Volkswagen Polo (Match),02/01/2024,"€15,317.00",2020,"23,397 miles",Hatchback,Manual,Petrol,"Navy Volkswagen Polo1.0 TSI 95 MATCH 5d 94 BHP \xa31,755 Upgraded Extras, 6.5in Touchscreen Display, Apple CarPlay, Android Auto, MirrorLink, DAB / Bluetooth / USB, Front /1 previous owner",Dublin
Volkswagen,Volkswagen Golf (SE),03/01/2024,"€9,193.00",2014,"62,329",Hatchback,Manual,Diesel,Black Volkswagen GolfSE TDI BLUEMOTION TECHNOLOGY 1.6 5dr3 previous owners,Wexford
Volkswagen,Volkswagen Tiguan (TDI),05/01/2024,"€9,849.00",2015,"79,695",SUV,Manual,Diesel,Blue Volkswagen Tiguan2.0 TDI BlueMotion Tech Match 4WD Euro 5 (s/s) 5dr,Longford
Volkswagen,Volkswagen Passat (Highline),06/01/2024,"€3,086.00",2009,"105,044",Saloon,Manual,Diesel,Volkswagen Passat2.0 TDI Highline Euro 5 4dr3 previous owners,Cork
Volkswagen,Volkswagen Scirocco (R-Line),07/01/2024,"€16,381.00",2017,"46,777",Hatchback,Automatic,Diesel,"Navy Volkswagen Scirocco2.0 R LINE TDI BLUEMOTION TECHNOLOGY DSG 2d 148 BHP **F/S/H**\xa320 ROAD TAX**19""ALLOYS**2 previous owners",Dublin
Volkswagen,Volkswagen T-Cross (TSI EVO),07/01/2024,"€27,176.00",2020,"6,902",SUV,Automatic,Petrol,Blue Volkswagen T-Cross1.5 TSI (150ps) R-Line EVO DSG 5dr2 previous owners,Mayo
Volkswagen,Volkswagen Golf (TSI),08/01/2024,"€11,444.00",2012,"26,136",Hatchback,Automatic,Petrol,Silver Volkswagen Golf1.4 TSI Match DSG Euro 5 5dr,Galway
Volkswagen,Volkswagen Polo (EVO),2024-01-12,"€18,183.00",2021,"2,892",Hatchback,Manual,Petrol,Blue Volkswagen PoloMK6 Hatchback 5Dr 1.0 80PS Match EVO,Kildare
Volkswagen,Volkswagen Golf (SE Nav),12/01/2024,"€17,413.00",2018,"24,086",Hatchback,Manual,Petrol,Blue Volkswagen GolfVolkswagen Golf 1.5 TSI EVO 130 SE Nav 5dr1 previous owner,Sligo
Volkswagen,Volkswagen Scirocco (TDI),14/01/2024,"€6,372.00",2012,"132,281 miles",Hatchback,Manual,Diesel,"Grey Volkswagen Scirocco2.0 TDI BlueMotion Tech R-Line Euro 5 (s/s) 3dr (Leather, Nav)2 previous owners",Meath
Volkswagen,Volkswagen Polo (beats),18/01/2024,"€15,662.00",2020,"25,041 miles",Hatchback,Manual,Petrol,Blue Volkswagen Polo Hatchback1.0 TSI 95 Beats 5dr1 previous owner,Kilkenny
Volkswagen,Volkswagen Golf (TSI EVO),21/01/2024,"€19,906.00",2020,"19,731",Hatchback,Manual,Petrol,Volkswagen Golf1.5 TSI EVO Match Edition 5dr,Dublin
Volkswagen,Volkswagen Golf (Match Edition),22/01/2024,"€22,366.00",2020,19921,Estate,Automatic,Petrol,Navy Volkswagen Golf1.5 TSI EVO 150 Match Edition 5dr DSG,Dublin
Volkswagen,Volkswagen Golf (GTI),23/01/2024,"€16,257.00",2014,"57,232 miles",Hatchback,Automatic,Petrol,Volkswagen Golf2.0 TSI BlueMotion Tech GTI DSG Euro 6 (s/s) 5dr,Dublin
Volkswagen,Volkswagen Taigo (TSI),2024-01-25,"€28,860.00",2022,"4,053",SUV,Automatic,Petrol,Grey Volkswagen Taigo1.5 TSI 150 R-Line 5dr DSG,Monaghan
Volkswagen,Volkswagen Tiguan (TDI),25/01/2024,"€12,388.00",2014,"31,081",S.U.V.,Automatic,Diesel,Volkswagen Tiguan2.0 TDI BlueMotion Tech Match DSG 4WD Euro 5 (s/s) 5dr1 previous owner,Dublin
Volkswagen,Volkswagen Tiguan (Match Edition),27/01/2024,"€12,722.00",2016,"55,109",SUV,Manual,Diesel,Grey Volkswagen Tiguan2.0 TDi BlueMotion Tech Match Edition 150 5dr 2WD3 previous owners,Dublin
Volkswagen,Volkswagen Golf (R),27/01/2024,"€21,435.00",2017,"49,394",Hatchback,Manual,Petrol,Navy Volkswagen Golf2.0 R 3d 298 BHP STUNNING LOOKING CAR!!!,Dublin
Volkswagen,Volkswagen Golf (SE),31/01/2024,"€9,783.00",2013,"50,464",Hatchback,Automatic,Diesel,Blue Volkswagen Golf1.6 TDI BlueMotion Tech SE DSG Euro 5 (s/s) 5dr,Dublin
Volkswagen,Volkswagen Touareg (BlueMotion Tech),02/02/2024,"€ 12,073",2013,"142,178",SUV,Automatic,Diesel,Blue Volkswagen Touareg3.0 TDI V6 BlueMotion Tech R-Line Tiptronic 4WD Euro 5 (s/s) 5dr6 previous owners,Kerry
Volkswagen,Volkswagen Golf (R-Line),03/02/2024,"€ 16,225",2018,"60,034",Hatchback,Manual,Diesel,Blue Volkswagen Golf2.0 TDI R-Line 5dr Diesel Hatchback,Dublin
Volkswagen,Volkswagen Tiguan (TSI),06/02/2024,"€30,137.00",2022,146,SUV,Automatic,Petrol,Red Volkswagen Tiguan1.5 TSI Life DSG Euro 6 (s/s) 5dr,Clare
